<?xml version="1.0" encoding="UTF-8"?>
<danhsach_donhang xmlns:xsi="http://www.w3.org/2001/XMLSchema-instance"
                  xsi:noNamespaceSchemaLocation="donhang.xsd">
    <!-- Danh sách sản phẩm -->
    <sanpham id="SP001">
        <name>iPhone 14 Pro</name>
        <price>25000000</price>
        <stock>50</stock>
    </sanpham>
    <sanpham id="SP002">
        <name>AirPods Pro</name>
        <price>5500000</price>
        <stock>100</stock>
    </sanpham>
    <sanpham id="SP003">
        <name>MacBook Air</name>
        <price>28000000</price>
        <stock>30</stock>
    </sanpham>
    <sanpham id="SP004">
        <name>Samsung Galaxy S23</name>
        <price>18000000</price>
        <stock>40</stock>
    </sanpham>
    
    <!-- Danh sách đơn hàng -->
    <order id="DH001">
        <customer>Huỳnh Đăng Khoa</customer>
        <date>2024-01-15</date>
        <order_items>
            <item productRef="SP001" quantity="2"/>
            <item productRef="SP002" quantity="1"/>
        </order_items>
    </order>
    
    <order id="DH002">
        <customer>Nguyễn Phúc Khang</customer>
        <date>2024-01-16</date>
        <order_items>
            <item productRef="SP003" quantity="1"/>
            <item productRef="SP002" quantity="2"/>
        </order_items>
    </order>
    
    <order id="DH003">
        <customer>Lê Văn Dinh</customer>
        <date>2024-01-17</date>
        <order_items>
            <item productRef="SP004" quantity="1"/>
            <item productRef="SP001" quantity="1"/>
        </order_items>
    </order>
</danhsach_donhang>